{
  "$schema": "https://devbox.zenit-hosting.de/schema/repository-state.v1.json",
  "active": {
    "revision": "3f1c2a9b8d7e6f5a4b3c2d1e0f9a8b7c6d5e4f3a",
    "path": "plugins",
    "fetchedAt": "2026-10-28T09:00:00Z",
    "plugins": [
      {
        "id": "tool-one",
        "name": "Tool one",
        "version": "1.0.0",
        "description": "Installs tool one",
        "digest": "sha256:a1b2c3d4e5f60718a1b2c3d4e5f60718a1b2c3d4e5f60718a1b2c3d4e5f60718",
        "permissions": [
          { "kind": "network", "value": "https://downloads.example.com" },
          { "kind": "files.read", "value": "${env:HOME}" },
          { "kind": "files.write", "value": "${env:HOME}/.local/bin" },
          { "kind": "sudo", "value": "true" },
          { "kind": "credentials", "value": "registry" }
        ],
        "requiresCommands": ["tar"]
      }
    ]
  },
  "pending": {
    "revision": "a1b2c3d4e5f60718a1b2c3d4e5f60718a1b2c3d4e5f60718a1b2c3d4e5f60718",
    "fetchedAt": "2026-10-29T09:00:00Z",
    "plugins": [
      {
        "id": "broken",
        "digest": "sha256:0000000000000000000000000000000000000000000000000000000000000000",
        "permissions": [],
        "requiresCommands": [],
        "error": "broken/plugin.json: /version: pattern mismatch"
      }
    ]
  },
  "lastSync": { "at": "2026-10-29T09:00:01Z", "changed": true },
  "lastError": "git clone failed: could not resolve host"
}
